index,ChapterName,Subject,Sub Subject,tags
286,COMPARING QUANTITIES,['Maths'],['Algebra'],compar quantiti math algebra
287,RATIONAL NUMBERS,['Maths'],"['Number', 'System']",ration number math number system
288,PERIMETER AND AREA ,['Maths'],['Geometry'],perimet and area math geometri
289,ALGEBRAIC EXPRESSIONS ,['Maths'],['Algebra'],algebra express math algebra
290,EXPONENTS AND POWERS,['Maths'],['Algebra'],expon and power math algebra
291,SYMMETRY,['Maths'],['Geometry'],symmetri math geometri
292,VISUALISING SOLID SHAPES ,['Maths'],['Geometry'],visualis solid shape math geometri
293,LINEAR EQUATIONS IN ONE VARIABLE,['Maths'],['Algebra'],linear equat in one variabl math algebra
294,UNDERSTANDING QUADRILATERALS,['Maths'],['Geometry'],understand quadrilater math geometri
295,SQUARES AND SQUARE ROOTS ,['Maths'],['Algebra'],squar and squar root math algebra
296,CUBES AND CUBE ROOTS,['Maths'],['Algebra'],cube and cube root math algebra
297,ALGEBRAIC EXPRESSIONS AND IDENTITIES,['Maths'],['Algebra'],algebra express and ident math algebra
298,EXPONENTS AND POWERS,['Maths'],['Algebra'],expon and power math algebra
299,DIRECT AND INVERSE PROPORTIONS,['Maths'],['Algebra'],direct and invers proport math algebra
300,FACTORISATION,['Maths'],['Algebra'],factoris math algebra
301,INTRODUCTION TO GRAPHS,['Maths'],['Geometry'],introduct to graph math geometri
302,PLAYING WITH NUMBERS,['Maths'],"['Number', 'System']",play with number math number system
303,NUMBER SYSTEMS,['Maths'],"['Number', 'System']",number system math number system
304,POLYNOMIALS,['Maths'],['Algebra'],polynomi math algebra
305,COORDINATE GEOMETRY,['Maths'],['Geometry'],coordin geometri math geometri
306,LINEAR EQUATIONS IN TWO VARIABLES,['Maths'],['Algebra'],linear equat in two variabl math algebra
307,INTRODUCTION TO EUCLID’S GEOMETRY,['Maths'],['Geometry'],introduct to euclid’ geometri math geometri
308,LINES AND ANGLES,['Maths'],['Geometry'],line and angl math geometri
309,TRIANGLES ,['Maths'],['Geometry'],triangl math geometri
310,QUADRILATERALS ,['Maths'],['Geometry'],quadrilater math geometri
311,AREAS OF PARALLELOGRAMS AND TRIANGLES,['Maths'],['Geometry'],area of parallelogram and triangl math geometri
312,CIRCLES,['Maths'],['Geometry'],circl math geometri
313,CONSTRUCTIONS,['Maths'],['Geometry'],construct math geometri
314,HERON’S FORMULA,['Maths'],['Geometry'],heron’ formula math geometri
315,SURFACE AREAS AND VOLUMES,['Maths'],['Geometry'],surfac area and volum math geometri
316,STATISTICS,['Maths'],['Probability'],statist math probabl
317,PROBABILITY,['Maths'],['Probabilty'],probabl math probabilti
318,PROOFS IN MATHEMATICS,['Maths'],"['Number', 'System']",proof in mathemat math number system
319,INTRODUCTION TO MATHEMATICAL MODELLING,['Maths'],"['Number', 'System']",introduct to mathemat model math number system
320,REAL NUMBERS,['Maths'],"['Number', 'System']",real number math number system
321,PAIR OF LINEAR EQUATIONS IN TWO VARIABLES,['Maths'],['Algebra'],pair of linear equat in two variabl math algebra
322,QUADRATIC EQUATIONS,['Maths'],['Algebra'],quadrat equat math algebra
323,ARITHMETIC PROGRESSIONS,['Maths'],['Algebra'],arithmet progress math algebra
324,TRIANGLES,['Maths'],['Geometry'],triangl math geometri
325,COORDINATE GEOMETRY,['Maths'],['Geometry'],coordin geometri math geometri
326,INTRODUCTION TO TRIGONOMETRY,['Maths'],['Trigonometry'],introduct to trigonometri math trigonometri
327,SOME APPLICATIONS OF TRIGONOMETRY,['Maths'],['Trigonometry'],some applic of trigonometri math trigonometri
328,AREAS RELATED TO CIRCLES,['Maths'],['Geometry'],area relat to circl math geometri
329,STATISTICS,['Maths'],['Probability'],statist math probabl
330,PROOFS IN MATHEMATICS,['Maths'],"['Number', 'System']",proof in mathemat math number system
331,MATHEMATICAL MODELLING,['Maths'],"['Number', 'System']",mathemat model math number system
332,SETS,['Maths'],"['Number', 'System']",set math number system
333,RELATIONS AND FUNCTIONS,['Maths'],"['Number', 'System']",relat and function math number system
334,TRIGONOMETRIC FUNCTIONS,['Maths'],['Trigonometry'],trigonometr function math trigonometri
335,PRINCIPLE OF MATHEMATICAL INDUCTION,['Maths'],"['Number', 'System']",principl of mathemat induct math number system
336,COMPLEX NUMBERS AND QUADRATIC EQUATIONS,['Maths'],['Algebra'],complex number and quadrat equat math algebra
337,LINEAR INEQUALITIES,['Maths'],['Algebra'],linear inequ math algebra
338,PERMUTATIONS AND COMBINATIONS ,['Maths'],['Probabilty'],permut and combin math probabilti
339,BINOMIAL THEOREM,['Maths'],['Algebra'],binomi theorem math algebra
340,SEQUENCES AND SERIES ,['Maths'],"['Number', 'System']",sequenc and seri math number system
341,STRAIGHT LINES,['Maths'],['Geometry'],straight line math geometri
342,CONIC SECTIONS,['Maths'],['Geometry'],conic section math geometri
343,INTRODUCTION TO THREE DIMENSIONAL GEOMETRY,['Maths'],['Geometry'],introduct to three dimension geometri math geometri
344,LIMITS AND DERIVATIVES,['Maths'],['Geometry'],limit and deriv math geometri
345,MATHEMATICAL REASONING,['Maths'],"['Number', 'System']",mathemat reason math number system
346,RELATIONS AND FUNCTIONS,['Maths'],"['Number', 'System']",relat and function math number system
347,INVERSE TRIGONOMETRIC FUNCTIONS,['Maths'],['Trigonometry'],invers trigonometr function math trigonometri
348,MATRICES,['Maths'],"['Number', 'System']",matric math number system
349,DETERMINANTS,['Maths'],"['Number', 'System']",determin math number system
350,CONTINUITY AND DIFFERENTIABILITY,['Maths'],"['Number', 'System']",continu and differenti math number system
351,APPLICATION OF DERIVATIVES,['Maths'],"['Number', 'System']",applic of deriv math number system
352,INTEGRALS,['Maths'],"['Number', 'System']",integr math number system
353,APPLICATION OF INTEGRALS,['Maths'],"['Number', 'System']",applic of integr math number system
354,DIFFERENTIAL EQUATIONS,['Maths'],"['Number', 'System']",differenti equat math number system
355,VECTOR ALGEBRA,['Maths'],['Algebra'],vector algebra math algebra
356,THREE DIMENSIONAL GEOMETRY,['Maths'],['Geometry'],three dimension geometri math geometri
357,LINEAR PROGRAMMING,['Maths'],['Algebra'],linear program math algebra
